{
  "$schema": "../patchouli.schema.json",
  "version": 1,
  "retention": { "idempotency_seconds": 86400, "changes_seconds": 604800 },
  "meta_fields": {
    "workspace_id": {
      "pointer": "/workspace_id",
      "schema": { "type": "string", "minLength": 1 }
    },
    "user_id": {
      "pointer": "/user_id",
      "schema": { "type": "string", "minLength": 1 }
    },
    "channel_id": {
      "pointer": "/channel_id",
      "schema": { "type": "string", "minLength": 1 }
    },
    "conflict_strategy": {
      "pointer": "/conflict_strategy",
      "schema": { "type": "string", "enum": ["merge", "mvcc", "reject"] }
    },
    "transaction_id": {
      "pointer": "/transaction_id",
      "schema": { "type": "string", "minLength": 1 }
    },
    "transaction_state": {
      "pointer": "/transaction_state",
      "schema": { "type": "string" }
    },
    "base_versions": {
      "pointer": "/base_versions",
      "schema": {
        "type": "array",
        "items": { "type": "string", "minLength": 1 },
        "minItems": 1,
        "uniqueItems": true
      }
    }
  },
  "entity_identity": {
    "scope_by": ["workspace_id", "user_id"]
  },
  "entity_types": {
    "knowledge": {
      "value_schema": {
        "$ref": "urn:patchouli:schema:knowledge:1"
      },
      "rules": [],
      "fallback": {
        "consistency": {
          "snapshot": {
            "mode": "shared",
            "key_by": ["transaction_id"]
          },
            "acquire": {
              "allow_sources": ["authority"],
              "requirements": [
                {
                  "kind": "linearizable",
                  "key_by": []
                }
              ]
            },
            "sessions": [],
          "commit": {
            "ordering": {
              "kind": "serialize",
              "key_by": []
            }
          }
        },
          "idempotency": {
            "mode": "disabled"
          },
        "conflict": {
          "default_strategy": "merge",
          "strategy_from": "conflict_strategy",
          "base_versions": "base_versions",
          "merge": [
            {
              "path": "/content",
              "strategy": "automerge",
              "group_by": ["/kind"]
            }
          ],
          "otherwise": "mvcc"
        },
        "publication": {
          "mode": "batch",
          "key_by": ["transaction_id"],
          "close_when": {
            "kind": "marker",
            "field": "transaction_state",
            "equals": "commit"
          },
          "staging_ttl_ms": 3600000,
          "on_expire": "discard"
        }
      }
    }
  }
}
