{
  "$schema": "./patchouli.schema.json",
  "version": 1,
  "retention": { "idempotency_seconds": 86400, "changes_seconds": 604800 },
  "meta_fields": {
    "workspace_id": {
      "pointer": "/workspace_id",
      "schema": { "type": "string", "minLength": 1 }
    },
    "user_id": {
      "pointer": "/user_id",
      "schema": { "type": "string", "minLength": 1 }
    },
    "channel_id": {
      "pointer": "/channel_id",
      "schema": { "type": "string", "minLength": 1 }
    },
    "conflict_strategy": {
      "pointer": "/conflict_strategy",
      "schema": { "type": "string", "enum": ["merge", "mvcc", "reject"] }
    },
    "base_versions": {
      "pointer": "/base_versions",
      "schema": {
        "type": "array",
        "items": { "type": "string", "minLength": 1 },
        "minItems": 1,
        "uniqueItems": true
      }
    }
  },
  "entity_identity": {
    "scope_by": ["workspace_id", "user_id"]
  },
  "entity_types": {
    "artifact": {
      "value_schema": {
        "$ref": "urn:patchouli:schema:artifact:1"
      },
      "rules": [],
      "fallback": {
        "consistency": {
          "snapshot": {
            "mode": "request"
          },
          "acquire": {
            "allow_sources": ["authority"],
            "requirements": [
              {
                "kind": "linearizable",
                "key_by": []
              }
            ]
          },
          "sessions": [],
          "commit": {
            "ordering": {
              "kind": "serialize",
              "key_by": []
            }
          }
        },
        "idempotency": {
          "mode": "disabled"
        },
        "conflict": {
          "default_strategy": "mvcc",
          "strategy_from": "conflict_strategy",
          "base_versions": "base_versions",
          "merge": [],
          "otherwise": "mvcc"
        },
        "publication": {
          "mode": "immediate"
        }
      }
    },
    "knowledge": {
      "value_schema": {
        "$ref": "urn:patchouli:schema:knowledge:1"
      },
      "rules": [],
      "fallback": {
        "consistency": {
          "snapshot": {
            "mode": "request"
          },
          "acquire": {
            "allow_sources": ["authority"],
            "requirements": [
              {
                "kind": "linearizable",
                "key_by": []
              }
            ]
          },
          "sessions": [],
          "commit": {
            "ordering": {
              "kind": "serialize",
              "key_by": []
            }
          }
        },
        "idempotency": {
          "mode": "disabled"
        },
        "conflict": {
          "default_strategy": "merge",
          "strategy_from": "conflict_strategy",
          "base_versions": "base_versions",
          "merge": [
            {
              "path": "/content",
              "strategy": "automerge",
              "group_by": ["/kind"]
            }
          ],
          "otherwise": "mvcc"
        },
        "publication": {
          "mode": "immediate"
        }
      }
    },
    "knowledge_relation": {
      "value_schema": {
        "$ref": "urn:patchouli:schema:knowledge-relation:1"
      },
      "rules": [],
      "fallback": {
        "consistency": {
          "snapshot": {
            "mode": "request"
          },
          "acquire": {
            "allow_sources": ["authority"],
            "requirements": [
              {
                "kind": "linearizable",
                "key_by": []
              }
            ]
          },
          "sessions": [],
          "commit": {
            "ordering": {
              "kind": "serialize",
              "key_by": []
            }
          }
        },
        "idempotency": {
          "mode": "disabled"
        },
        "conflict": {
          "default_strategy": "mvcc",
          "strategy_from": "conflict_strategy",
          "base_versions": "base_versions",
          "merge": [],
          "otherwise": "mvcc"
        },
        "publication": {
          "mode": "immediate"
        }
      }
    }
  }
}
